### ISSUE TITLE
TeXlive url unreachable

### ISSUE THREAD

**Issue by jngrad** [espressomd/docker#126]
When building the `cuda:10.1` image, the tlmgr command can fail silently if an URL cannot be reached, causing a failure in the espresso weekly build (espressomd/espresso#3038, [logfile](https://gitlab.icp.uni-stuttgart.de/espressomd/espresso/-/jobs/143405)).

Expected behavior:
```
INFO[1311] args: [-c tlmgr init-usertree     && tlmgr install pgf tikz-3dplot revtex units mhchem chemgreek todonotes upquote framed subfigure cleveref     && tlmgr install lm stmaryrd 2>&1 || :     && updmap -user] 
(running on Debian, switching to user mode!)
tlmgr: package repository http://ctan.space-pro.be/tex-archive/systems/texlive/tlnet (verified)
[1/11, ??:??/??:??] install: chemgreek [7k]
[2/11, 00:00/00:00] install: cleveref [28k]
```
Problematic behavior: failure to reach the URL on [bwCloud](https://gitlab.icp.uni-stuttgart.de/espressomd/docker/-/jobs/142221), [elk](https://gitlab.icp.uni-stuttgart.de/espressomd/docker/-/jobs/142256) and coyote4 (outside CI):
```
INFO[1310] args: [-c tlmgr init-usertree     && tlmgr install pgf tikz-3dplot revtex units mhchem chemgreek todonotes upquote framed subfigure cleveref     && tlmgr install lm stmaryrd 2>&1 || :     && updmap -user] 
(running on Debian, switching to user mode!)

/usr/bin/tlmgr: TLPDB::from_file could not download https://ftp.agdsn.de/pub/mirrors/latex/dante/systems/texlive/tlnet/tlpkg/texlive.tlpdb;
/usr/bin/tlmgr: maybe the repository setting should be changed.
```

Manually creating the `cuda:10.1` image is possible on my desktop machine but not on coyote4 due to the unreachable URL. In CI, the URL is sometimes unreachable in bwCloud, and on elk there is only one data point, where it was unreachable. The URL is selected at random in a list of known mirrors.

Unfortunately tlmgr doesn't return an error code when that happens, so I'll have to add more bash commands to grep the stderr output, such as (doesn't work but probably close):
```bash
RUN ... \
    && ! tlmgr install ... 2>&1 | grep --quiet "TLPDB::from_file could not download" \
    && ...
```
This way the build fails if the LaTeX packages are not installed, and the job has to be retried.

**Comment by mkuron** [comment]
That’s odd. Elk and bwCloud don‘t have a firewall, so this can’t be an infrastructure problem. Most likely one of the mirrors is dead or it‘s used over HTTPS without having the CA certificates installed?

**Comment by mkuron** [comment]
The agdsn.de mirror is broken. I can reproduce that locally with
```
tlmgr --repository https://ftp.agdsn.de/pub/mirrors/latex/dante/systems/texlive/tlnet update --list
``

**Comment by jngrad** [comment]
I thought tlmgr would check multiple URLs until an active one is found, but it seems like it picks one and retries it multiple times for 30 seconds:
```bash
tcpdump -i any -w /tmp/http.log &
tlmgr init-usertree
tlmgr install pgf tikz-3dplot revtex units
tcpdump -A -n -r /tmp/http.log | less
```
stdout contains this message repeated multiple times:
```
08:17:09.303648 IP 172.17.0.2.52721 > 129.69.252.252.53: 27772+ A? mirror.ctan.org. (33)
E..=..@.@........E.....5.)*.l|...........mirror.ctan.org.....
08:17:09.303703 IP 172.17.0.2.52721 > 129.69.252.252.53: 57739+ AAAA? mirror.ctan.org. (33)
E..=..@.@........E.....5.)*..............mirror.ctan.org.....
08:17:09.304060 IP 129.69.252.252.53 > 172.17.0.2.52721: 27772 1/3/0 A 5.35.249.60 (118)
E.......<.k..E.......5...~.)l|...........mirror.ctan.org.............$....#.<.............comedy.dante.de............
.ns1.tug...............ns2.^
08:17:09.304069 IP 129.69.252.252.53 > 172.17.0.2.52721: 57739 0/1/0 (82)
E..n....<.k;.E.......5...Z'..............mirror.ctan.org.............   ..%.ns1.tug...root.1...K..*0.....       :...8@
08:17:09.304182 IP 172.17.0.2.55970 > 5.35.249.60.80: Flags [S], seq 4040123425, win 29200, options [mss 1460,sackOK,TS val 3275184554 ecr 0,nop,wscale 8], length 0
E..<..@.@..u.....#.<...P..d!......r............
.7Y.........
08:17:09.304244 IP 172.17.0.1 > 172.17.0.2: ICMP 5.35.249.60 tcp port 80 unreachable, length 68
```
Setting the mirror is probably our best option.
